Молитва,Лермонтов М.Ю.,"""Как писатель он (М.Ю.Лермонтов) поражает прежде всего умом смелым, тонким и пытливым... Он дал нам такие произведения, которые обнаруживали в нем громадные задатки для будущего. Он не мог обмануть надежд, возбужденных им. И если бы не смерть, так рано прекратившая его деятельность, он, может быть, занял бы первое место в истории русской литературы"". (Иван Панаев)",2 100 тг,5,Эксмо,2018 г.,9785040910700,368,Твердый,30 мм,260 г.,Неизвестно,http://www.bookcity.kz/content/images/thumbs/5116978_1449905.jpeg
Молитвы. Избранное,"Пушкин А.С., Ахматова А.А., Па","В книгу включены избранные лучшие молитвы русских поэтов от Симеона Полоцкого до Марины Цветаевой и Бориса Пастернака. В книге представлено более 95 авторов, а также раздел, посвященный стихотворным переложениям русских поэтов молитвы ""Отче наш"".",2 100 тг,2,Эксмо,2016 г.,9785699929467,384,Твердый,165 мм x 120 мм,25 мм,245 г.,http://www.bookcity.kz/content/images/thumbs/5098385_1436338.jpeg
"Мудрость Восточной поэзии. Хайам, Низами, Саади.",Хайям О.,"Творчество поэтов Востока — Омара Хайама, Низами Гянджеви, Саади — обладает удивительным свойством — какой-то особой, непостижимой независимостью от времени, совершенной неувядаемостью. Чтобы подчеркнуть эту особенность текст сопровождается как картинами французского художника Жана-Леона Жерома, так и работами классиков восточного изобразительного искусства Ага Мирека, Абдаль-Раззака, Мир Сеида Али, Музаффара Али, Муина Мусаввира, Ризы-йи-Аббаси, Султана Мухаммеда Низамеддина и других известных персидских художников, выполненных ими для иллюстрации средневековых манускриптов. Творчество мастеров миниатюрной живописи органично дополняет поэзию великих мыслителей, помогает воспринимать читателю дух национальной культуры, к которой принадлежали авторы знаменитых произведений.",3 000 тг,2,АСТ,2017 г.,9785179831716,352,Твердый,30 мм,260 г.,Неизвестно,http://www.bookcity.kz/content/images/thumbs/5114424_1447544.jpeg
Мужская лирика. Женская лирика,Ах Астахова,"Ирина Астахова (творческий псевдоним Ах Астахова) - один из самых востребованных поэтов в современном русскоязычном пространстве.Широкая известность пришла к автору после публикации видео на стихотворение ""Тебя хоть там любят?"". Сейчас, армия поклонников Ах Астаховой насчитывает сотни тысяч человек по всему миру. Астаховой, удается собирать полные залы театров и филармоний, как в России, так и за рубежом.Сборник ""Мужское/Женское"" - это переиздание дебютной книги Ах Астаховой ""Мужская/Женская лирика"", в которой представлены стихотворения, написанные от лица двух противоположностей, уживающихся в авторе. Прямые и строгие рифмы, свойственные мужчине, контрастируют с нежностью и трогательностью женской души. Данное переиздание дополнено жизнеутверждающими стихами нового творческого этапа Ирины. Автор раскрывает секреты нахождения своего жизненного пути, делится представлениями о достижении состояния счастья и рассуждает о гармоничном взаимодействии с окружающем миром.",4 500 тг,0,Эксмо,2018 г.,9785040922369,Твердый,220 мм x 150 мм,25 мм,600 г.,Неизвестно,http://www.bookcity.kz/content/images/thumbs/5129794_1462226.jpeg
Набережная неисцелимых,Бродский И.А.,"НАБЕРЕЖНАЯ НЕИСЦЕЛИМЫХ - одно из самых известных эссе Иосифа Бродского, посвященное Венеции. ""Фондамента Инкурабили"" (так это звучит по- итальянски) действительно существовала в Средние века, а название ей дал госпиталь и прилегающие к нему кварталы, в которых в те времена содержались безнадежно больные жители, зараженные чумой. Когда эпидемия, унесшая тысячи жизней, отступила, горожане соорудили в память об избавлении церковь Санта Мария делла Салюте, которая стоит и по сей день. Возможно, это место, где соединяются вода и камень, место, не отмеченное на современных картах, напоминало поэту родной город. Джон Апдайк писал: ""Эссе НАБЕРЕЖНАЯ НЕИСЦЕЛИМЫХ - это попытка превратить точку на глобусе в окно в мир универсальных переживаний, частный опыт хронического венецианского туриста - в кристалл, чьи грани отражали бы всю полноту жизни..."" В настоящем издании этот текст публикуется на двух языках - на английском, как он был написан автором, и в блестящем переводе...",2 600 тг,3,Лениздат,2014 г.,9785445309444,192,Мягкий,13 мм,105 г.,Неизвестно,http://www.bookcity.kz/content/images/thumbs/5072141_1411617.jpeg
Наблюдения за жизнью,Вирозуб М.,"М.Вирозуб - сторонник ясности. Это привело его к верлибру, где, как он считает, особенно заметны ""необязательные"" слова. Но главное - автору есть что сказать. Он думает, чувствует, а не выдумывает мысли и чувства.  Книга, несмотря на небольшой объем, разнообразна.  В ней представлены любовная лирика и философская поэзия, остроумные детские стихи и переводы: от религиозного визионера Г. Воэна до едкого К.Моргенштерна, от Средневековья до ХХ века.",2 300 тг,0,Время,2010 г.,9785969105621,160,Мягкий,165 мм x 130 мм,10 мм,Неизвестно,http://www.bookcity.kz/content/images/thumbs/5026757_1347902.jpeg
"Не жалею, не зову, не плачу",Есенин С.А.,"Если Пушкин – России первая любовь, то Есенин ее последняя горькая страсть… Стихи Есенина твердят наизусть и поют под гитару даже те, кто вообще-то стихов не читает, потому что Есенин – не просто изумительный лирик, художник уникального, феноменального дара, он – певчая душа России, ее вешняя радость и вечная боль.",2 000 тг,5,Эксмо,2014 г.,9785699607488,384,Твердый,165 мм x 120 мм,21 мм,298 г.,http://www.bookcity.kz/content/images/thumbs/5060488_1401157.jpeg
"Не жалею, не зову, не плачу?",Есенин С.А.,"Сергей Есенин - поэт непревзойденного лирического дара. Его проникновенные стихи о родном крае, о любви, о России известны каждому со школьной скамьи, многие из них положены на музыку и обрели новую жизнь в качестве любимых всеми песен и романсов. Широко известны и поэмы Есенина, раскрывающие перед нами не только лирический, но и драматический талант всенародно любимого поэта.",8 400 тг,1,Олма Медиа Групп,2017 г.,9785001112129,256,Твердый,290 мм x 205 мм,30 мм,935 г.,http://www.bookcity.kz/content/images/thumbs/5115837_1448815.jpeg
Не позволяй душе лениться,Заболоцкий Н.А.,"Николай Алексеевич Заболоцкий (1903-1958), выдающийся и интереснейший поэт России XX века, прошел в литературе сложный путь - от ритмического новаторства и принципиально условной эстетики до прозрачной ясности классического стиха: ""Любите живопись, поэты..."" Этот сборник, составленный сыном поэта Никитой Заболоцким, включает полный свод стихотворений и поэм, вошедших в литературное завещание автора, а также стихотворения из ранних собраний.",2 200 тг,4,Эксмо,2017 г.,9785699967957,Твердый,21 мм,Неизвестно,Неизвестно,Неизвестно,http://www.bookcity.kz/content/images/thumbs/5127358_1459846.jpeg
Не сыпь мне соль на рану:,Осиашвили С.,"Немало песен Симона Осиашвили вошло в золотой фонд нашей эстрады, это всенародно любимые - ""Дорогие мои старики"", ""Бабушки-старушки"", ""Колодец"" и многие другие. Но поэт работает не только в песенном жанре. Вот уже двадцать лет Симон Осиашвили своё мироощущение выражает в стихотворениях. И стихам, и песням присущи лиризм и ирония, драматизм и юмор, но главное, все они наделены теплотой и душевностью.  В этой книге стихи и песни органично переплетаются с рассказом автора о своей судьбе, жизненных коллизиях и интересных встречах.",1 600 тг,0,Время,2006 г.,9785969101579,304,Твердый,167 мм x 146 мм,18 мм,320 г.,http://www.bookcity.kz/content/images/thumbs/5046959_1369454.jpeg
Не теряйте отчаянья. Новая книга. Стихи 2014-2015 гг.,Евтушенко Е.А.,"В новую книгу Евгения Александровича Евтушенко, знаменитого поэта-шестидесятника, вошли стихи, написанные в 2014–2015 гг. Стихи о любви и достоинстве, о мире и войне, о милосердии, о силе поэзии и силе добра, об отчаянии и надежде, о мужестве. Честный разговор о времени и о себе... «Типичный» Евтушенко, как сказал автор, отдавая сборник в печать, - Евтушенко, которого знают и любят многие поколения читателей.",2 300 тг,2,Азбука-Аттикус,2015 г.,978538910121001,144,Твердый,165 мм x 120 мм,14 мм,Неизвестно,http://www.bookcity.kz/content/images/thumbs/5071995_1411472.jpeg
Небесная лиса,Воденников Д.,"Первая книга Дмитрия Воденникова вышла в 1996 году. Вот уже более двадцати лет Воденников остается одним из самых непредсказуемых авторов, чья поэзия способна удивлять и приводить в восхищение. Сам автор говорит о себе так: «Я не занимаюсь творчеством. Я жду стихов, потом их пишу. Все остальное время я занимаюсь тем, что испытываю жизнь».
Настоящее издание представляет собрание стихотворений и поэм разных лет, настоящий подарок всем поклонникам поэтического слова.",2 900 тг,0,Азбука-Аттикус,2018 г.,978538915127701,Твердый,20 мм,Неизвестно,Неизвестно,Неизвестно,http://www.bookcity.kz/content/images/thumbs/5133556_1465569.jpeg
Нежнее нежного?,Мандельштам О.Э.,"Осип Мандельштам - великий поэт Серебряного века, погибший в годы репрессий в сталинских лагерях. Его стихи долгое время находились под запретом, но, тем не менее, были известны читателю, переходя из уст в уста, от сердца к сердцу. Критики упрекали его в несовременности, излишней метафоричности, а между тем его стихи до сих пор манят и чаруют читателя сложными образами, непростыми смыслами и неподдельностью чувств, какой-то особенной нежностью и чувственностью. Друзья подтрунивали над его неприспособленностью к жизни и старались уберечь от бытовых неурядиц, после же - навсегда ""сохранили его речь"". Поэзия Мандельштама - ""музыка небесных сфер"", каждое стихотворение - застывший миг, тончайший срез настоящего. Перед вами лучшие образцы его поэтической лирики, написанные в разные годы.",8 400 тг,0,Олма Медиа Групп,2018 г.,9785001112662,Твердый,15 мм,Неизвестно,Неизвестно,Неизвестно,http://www.bookcity.kz/content/images/thumbs/5133647_1465623.jpeg
Незнакомка,Блок А.А.,"Поэт-рыцарь, поэт-мистик, поэт-эпоха. Его перу принадлежат стихотворения, определившие магическое звучание поэзии Серебряного века и одновременно ставшие связующим звеном между литературой модерна и классической русской поэзией. Превыше всего Александр Блок ценил «тайную свободу», воспетую Пушкиным и дарованную поэту, чтобы выполнить его таинственное предназначение. Поэзия была для него, как писал Владислав Ходасевич, «первейшим, реальным духовным подвигом, неотделимым от жизни». В книгу вошли избранные произведения Александра Блока, среди которых стихотворения, составившие его лирическую «трилогию», а также поэма «Двенадцать».",2 800 тг,1,Азбука-Аттикус,2019 г.,978538915924201,Твердый,10 мм,Неизвестно,Неизвестно,Неизвестно,http://www.bookcity.kz/content/images/thumbs/5129394_1461851.jpeg
Непоэмание,Полозкова В.,"Стихи Веры Полозковой - это такое же ураганное и яркое явление, как и она сама. Неимоверный магнетизм ее обаяния и точные ритмы суждений переносятся в книгу, где каждый находит самого себя: окрылённого, расстроенного, обманутого или влюбленного.",3 500 тг,4,Гаятри,2015 г.,9785904584610,224,Твердый,240 мм x 170 мм,33 мм,325 г.,http://www.bookcity.kz/content/images/thumbs/5081662_1420370.jpeg
Новые стансы к Августе,Бродский И.А.,"Сборники стихотворений Иосифа Бродского (1940-1996) «Остановка в пустыне» (1970), «Конец прекрасной эпохи» (1977), «Часть речи», «Новые стансы к Августе» (1983), «Урания» (1987) и «Пейзаж с наводнением» (1996) были опубли­кованы в 1970-1990-е годы в американском издательстве «Ардис». Над составлением этих книг работал сам поэт в со­трудничестве с его друзьями Карлом и Эллендеей Проффер, основателями «Ардиса». В этом легендарном издательстве, как и в издательствах «Посев» и «IMCA-Press», много лет вы­ ходили произведения русской литературы, которые не могли увидеть свет в Советском Союзе. Бродский писал о Карле Проффере: «Он вернул русской литературе непрерывность развития и тем самым восстановил ее достоинство... он спас многочисленных русских писателей и поэтов от забвения, от искажения их слова, от нервной болезни и отчаяния. Более того, он изменил сам климат русской литературы». В сборник «Новые стансы к Августе», представленный в настоящем из­дании, вошли...",2 800 тг,0,Лениздат,2014 г.,9785445307822,160,Мягкий,13 мм,85 г.,Неизвестно,http://www.bookcity.kz/content/images/thumbs/5065968_1405890.jpeg
О страстях и пороках,Шекспир У.,"Четырнадцать убийств, три отрезанных руки, две отрубленных головы, групповое изнасилование и глумление над жертвой. Патриархальный римлянин убивает сына и дочь ради чести, варвары терзают для потехи, молодой император казнит соперников, а заброшенный игрой случая в столицу мира мавр, воплощенный дьявол, сожалеет лишь о том, что не свершил в десять раз больше.   В кровавой драме в духе кровавого XVI века, раннем произведении У. Шекспира, откровенно звучит главная тема, которую мы находим в его великих трагедиях: источник любой страсти и любого порока - своеволие и необоримая потребность ""взять свое"". Страшный девиз ""каждому свое"" начертан над входом в созданный Шекспиром ад больших и малых, но всегда смертоносных страстей.",900 тг,2,Эксмо,2011 г.,9785699462650,192,Твердый,165 мм x 107 мм,15 мм,175 г.,http://www.bookcity.kz/content/images/thumbs/5013983_1335139.jpeg
Облака выбирают анапест. Кушнер,Кушнер А.С.,"Поэзия Александра Кушнера, одного из самых известных и читаемых поэтов нашего времени, являет собой уникальный пример классической стихотворной традиции, не просто вплавленной в сегодняшний мир, но-в нем живущей. Это стихи, остро переживающие жизнь - и приемлющие ее, вопреки ее несовершенствам, но в согласии с вечной красотой природы, человека и созданной им культуры. В новую книгу петербургского мастера вошли стихи 2005-2007 гг.",1 500 тг,0,Аванта+,2008 г.,9785989861569,96,171 мм x 125 мм,9 мм,147 г.,Неизвестно,http://www.bookcity.kz/content/images/thumbs/5033187_1355463.jpeg
Одари меня ночь,Неизвестно,Неизвестно,1 900 тг,0,Международный клуб любителей поэзии Абая,2016 г.,9786017294724,Твердый,20 мм,Неизвестно,Неизвестно,Неизвестно,http://www.bookcity.kz/content/images/thumbs/5092269_1430190.jpeg
Однофамилец,Чухонцев О.,"Чухонцев любит рассказывать в стихе, обдумывать, сомневаться, но понять в нем главное, значит осознать, что он - лирик, самый значительный лирический поэт рубежа веков, отстоявший ее достоинство в тот момент, когда лирика вышла из моды. В предшествующие десятилетия, ее писали, оставляя ощущение преизбытка, разменянной эмоции. И тогда, когда ее писали сверх меры, и тогда, когда ее застыдились писать, Чухонцев оставался верен лирике и классически строг по отношению к самому себе.",3 000 тг,0,Время,2008 г.,9785969102859,128,Твердый,290 мм x 220 мм,17 мм,Неизвестно,http://www.bookcity.kz/content/images/thumbs/5077363_1416611.jpeg
Неизвестно,Неизвестно,Неизвестно,Неизвестно,Неизвестно,Неизвестно,Неизвестно,Неизвестно,Неизвестно,Неизвестно,Неизвестно,Неизвестно,Неизвестно,Неизвестно
Омар Хайям. Афоризмы,Хайям О.,"В этом сборнике собраны все самые интересные, самые интригующие и самые мудрые высказывания Омара Хайяма. Читайте их, учитесь, находите ответы на интересующие вас вопросы, делайте выводы, проверяйте их на практике и становитесь мудрыми, любящими и любимыми!",1 600 тг,4,АСТ,2017 г.,9785171022358,192,Твердый,20 мм,135 г.,Неизвестно,http://www.bookcity.kz/content/images/thumbs/5114443_1447563.jpeg
