Рубайат в классическом переводе Германа Плисецкого,Хайям О.,"Знаменитые четверостишия-рубай Омара Хайама переводятся на русский язык уже более ста лет, но с особым успехом - начиная с 70-х годов XX века. В сборник, который вы держите в руках, вошли рубаи, переведенные замечательным поэтом и переводчиком восточной поэзии Германом Плисецким. ""Хайам Германа Плисецкого убеждает прежде всего потому, что в его переводах старый иранский мудрец - действительно великий поэт"" (Б.Слуцкий). Дополнительную ценность сборнику придают вступительное эссе Самуила Лурье ""Бином Хайама"", предисловие самого поэта-переводчика и послесловие с рассказом о его судьбе.",2 000 тг,2,Эксмо,2015 г.,9785699390496,288,Твердый,165 мм x 120 мм,16 мм,237 г.,http://www.bookcity.kz/content/images/thumbs/5048084_1370365.jpeg
Руслан и Людмила,Пушкин А.С.,"Литературная репутация Пушкина складывалась во многом благодаря популярности его поэм. Первая пушкинская поэма ""Руслан и Людмила"" сделала имя автора известным всей читающей публике. Каждая новая его поэма - ""Кавказский пленник"", ""Бахчисарайский фонтан"", ""Цыганы"", ""Граф Нулин"", ""Полтава"", ""Домик в Коломне"" - становилась предметом жаркой полемики и поводом для обсуждения насущных вопросов русской литературы. В книгу вошли все завершенные поэмы Пушкина, включенные в авторское издание ""Поэмы и повести"", а также поэма ""Медный всадник"", которая не была пропущена к печати ""высочайшей цензурой"".",1 400 тг,5,Азбука-Аттикус,2017 г.,978538913586402,352,Твердый,210 мм x 140 мм,30 мм,245 г.,http://www.bookcity.kz/content/images/thumbs/5111718_1445137.jpeg
Руслан и Людмила. Поэмы,Пушкин А.С.,"Творчество Александра Сергеевича Пушкина удивительно многогранно. Поэт, прозаик, драматург, он с одинаковой свободой владел всеми литературными жанрами. ""Не было почти явления в природе, события в обыденной общественной жизни, которые бы прошли мимо его, не вызвав дивных и неподражаемых звуков его музы"", - писал о нем его лицейский друг И.И.Пущин. В настоящее издание вошли наиболее известные поэмы Пушкина: первая поэма ""Руслан и Людмила"", южные поэмы ""Кавказский пленник"", ""Бахчисарайский фонтан"", ""Братья разбойники"", ""Цыганы"", стихотворные повести ""Граф Нулин"", ""Домик в Коломне"", поэмы ""Полтава"", ""Анджело"" и ""Медный всадник"". Обратившись к этому жанру, исследующему взаимодействие человека и мира, Пушкин задается главными вопросами: возможно ли противостоять судьбе? Что такое героический характер и свобода личности? Что такое человек для истории и история для человека? Рассказывая о ""преданьях старины глубокой"" и рисуя свой век и свое время, поэт от сказочных, элегических и шуточных...",1 100 тг,4,Лениздат,2013 г.,978544530203201,352,Мягкий,19 мм,180 г.,Неизвестно,http://www.bookcity.kz/content/images/thumbs/5055508_1398026.jpeg
Русская поэзия 17- 20 веков (DVD-box),Неизвестно,"Литературное собрание охватывает период от XVII века, времени расцвета силлабической поэзии, до первой половины XX столетия, поры авангарда и экспериментов. Широко представлено искусство школ Серебряного века: символизм, акмеизм, футуризм и других. Коллекция включает произведения 100 поэтов с их биографиями и портретами, в том числе полные собрания поэтических сочинений А. С. Пушкина, М. Ю. Лермонтова, А. А. Блока, Вяч. Иванова, М. И. Цветаевой.",5 600 тг,0,Не указано,9785948650418,15 мм,Неизвестно,Неизвестно,Неизвестно,Неизвестно,Неизвестно,http://www.bookcity.kz/content/images/thumbs/5012544_1334186.jpeg
Русская поэзия XVIII века,Неизвестно,"Этот сборник содержит наиболее известные произведения русских поэтов XVIII столетия (М.Ломоносова, В.Тредиаковского, А.Сумарокова, Г.Державина и др.). Культура той эпохи характеризуется, прежде всего, классицизмом, а также - его истоками и немедленными последствиями. Русский классицизм имеет свои особые черты, воссоздание и оживление которых необходимо для полноты современного национального сознания. Чтение русской поэзии XVIII века состраивает душу читателя с прошлым и - с будущим.",1 800 тг,0,Эксмо,2010 г.,9785699428045,480,Твердый,165 мм x 130 мм,25 мм,Неизвестно,http://www.bookcity.kz/content/images/thumbs/5005668_1330089.jpeg
Русская поэзия. XXI век. Антология,Неизвестно,"Это наиболее полное поэтическое издание в XXI веке - антология лучших поэтических произведений, создававшихся от 2000 года по сегодняшний день, явление историческое и уникальное, поскольку включает в себя около четырехсот имен поэтов разных поколений и эстетических групп и школ не только со всей России (от Москвы до Иркутска, от Смоленска до Чукотки, от Оренбурга до Воронежа, от Пскова до Красноярска, от Сыктывкара до Нижнего Новгорода, от Санкт-Петербурга до Калининграда), но и со всего русскоя",4 400 тг,0,Вече,2010 г.,9785953338745,464,Твердый,288 мм x 203 мм,26 мм,1139 г.,http://www.bookcity.kz/content/images/thumbs/5010989_1332235.jpeg
"Русь моя, жизнь моя...","Пушкин А.С., Блок А.А., Ахматова А.А. и др.","Какая она Россия? Родина - мать, защитница и созидательница! В книгу включены лучшие образцы размышлений русских поэтов о своей родине - о России.",1 900 тг,0,Эксмо,2018 г.,9785699997671,256,Твердый,1 мм,501 г.,Неизвестно,http://www.bookcity.kz/content/images/thumbs/5118757_1451630.jpeg
Сад любви,Хайям О.,"В поэтический сборник «Сад любви» включены бессмертные четверостишия Омара Хайяма, классика персидской поэзии, великого философа, астронома и математика. В это издание вошли лучшие русскоязычные переводы О. Хайяма.",1 900 тг,3,Эксмо,2017 г.,9785699607679,Твердый,10 мм,Неизвестно,Неизвестно,Неизвестно,http://www.bookcity.kz/content/images/thumbs/5116942_1449868.jpeg
Свеча горела,Пастернак Б.Л.,"Творчество Бориса Пастернака – великого русского поэта, писателя, второго русского лауреата Нобелевской премии по литературе, автора знаменитого романа «Доктор Живаго» – органично сочетает в себе традиции русской и мировой классики с достижениями поэзии Серебряного века и авангарда. В книгу включены самые лучшие стихотворения Б.Пастернака, отражающие неповторимые грани его поэтического дарования.",1 900 тг,5,Эксмо,2016 г.,9785699866175,416,Твердый,165 мм x 120 мм,30 мм,305 г.,http://www.bookcity.kz/content/images/thumbs/5098047_1436010.jpeg
Свеча горела...,Пастернак Б.Л.,"В настоящем издании представлено творческое наследие одного из величайших русских поэтов, лауреата Нобелевской премии Бориса Леонидовича Пастернака. От ранних ""неистовых"" стихов он шел к ""ошеломляющей простоте"" поздней лирики. Многими поколениями читателей его произведения любимы, как чистый звук в оглушающем шуме эпохи. По словам Цветаевой, у Пастернака никогда не будет ""площади"", но будет ""множество одиноких, одинокое множество жаждущих, которых он, уединенный родник, поит"". В книгу включены избранные стихотворения Б.Л.Пастернака разных лет.",2 800 тг,4,Азбука-Аттикус,2018 г.,9785389145849,368,Твердый,21 мм,315 г.,Неизвестно,http://www.bookcity.kz/content/images/thumbs/5120112_1452924.jpeg
"Сердце, дух и прах. Рубаи",Хайям О.,"Универсальный гений такого же масштаба, как Леонардо да Винчи, и родившийся так же несвоевременно. Омару Хайяму в истории повезло еще меньше. Ни одно из его научных открытий не было понято современниками, потому и не сыграло никакой роли в общечеловеческом прогрессе. Написанные им стихи соответствовали мышлению совершенно другой эпохи, а потому уцелели благодаря буквально нескольким почитателям.",4 900 тг,3,Рипол Классик,2018 г.,9785386091361,496,Твердый,215 мм x 145 мм,35 мм,745 г.,http://www.bookcity.kz/content/images/thumbs/5084643_1423619.jpeg
"Сердце, дух и прах. Рубаи. Полное собрание (2-е оформ.). Хайям О.",Хайям О.,"Омар Хайям - выдающийся ученый, философ и поэт XI века, создатель знаменитого ""Рубайята"". Написанные почти тысячелетие назад четверостишия - рубаи, прославляющие мудрость, любовь, красоту и радости мира, необыкновенно привлекательны и для современного читателя. Не случайно, что рубаи Хайяма по сей день с наслаждением читает весь мир.",6 000 тг,0,Рипол Классик,2017 г.,9785386091989,496,Твердый,215 мм x 145 мм,40 мм,720 г.,http://www.bookcity.kz/content/images/thumbs/5099386_1435822.jpeg
Серебро Господа моего,Гребенщиков Б.,"Из поэтических строк Бориса Гребенщикова складывается картина духовного поиска удивительного ""беспечного русского бродяги"", поэта, независимо от существующих общепринятых норм не желающего изменять представлениям о своем кредо и месте в русской культуре. И потому его стихи и песни всегда будоражат, всегда радуют и рождают лучшие качества в душе любого читателя и слушателя. В книгу включены лучшие тексты песен, написанные за время всего творческого пути автора , в том числе из умиротворяющего альбома ""А+"" и тревожного, издающегося впервые, ""Соль"" - подлинная поэзия, которая по-настоящему открывается, когда задерживаешься на строках, вчитываешься: тогда они обретают реальную плотность и осознаннее становятся глубина и масштаб сказанного. Оригинальный взгляд Дм.Быкова на творчество Бориса Гребенщикова представлен во вступительной статье ""Партизан полной Луны"".",1 300 тг,0,Эксмо,2015 г.,9785699845811,352,Твердый,165 мм x 120 мм,20 мм,270 г.,http://www.bookcity.kz/content/images/thumbs/5080076_1418941.jpeg
Серебряный век русской поэзии,Неизвестно,"Стильно оформленное подарочное издание с серебристым тиснением на обложке. В конце XIX - начале XX века Россия переживала мощный взлет русской культуры, ""русский культурный ренессанс"", позже названный ""Серебряным веком"". Но Серебряный век - не просто хронологический период и даже не конгломерат различных литературных течений. Речь идет об образе мышления, который, будучи характерен для поэтов, при жизни часто конфликтовавших между собой, в конце концов объединил их в сознании потомков в неразделимую плеяду звезд, сформировавших неповторимую и чарующую атмосферу Серебряного века русской поэзии. Анна Ахматова и Николай Гумилев, Марина Цветаева и Осип Мандельштам, Александр Блок и Константин Бальмонт, Владимир Маяковский и Игорь Северянин, Иван Бунин и Валерий Брюсов, Сергей Есенин и Николай Клюев - мы представляем вам всю богатейшую палитру поэзии Серебряного века.",18 700 тг,0,Олма Медиа Групп,2015 г.,9785001112341,448,Твердый,340 мм x 245 мм,38 мм,2145 г.,http://www.bookcity.kz/content/images/thumbs/5049073_1392693.jpeg
Серебряный век. Избранная лирика,"Ахматова А., Есенин С., Цветаева М.","Серебряный век - время великого расцвета духовной жизни России, пришедшееся на конец XIX - начало XX века, когда жили и творили такие гениальные поэты, как А. Блок, Н. Гумилев, М. Цветаева, О. Мандельштам, А. Ахматова, С. Есенин, В. Маяковский, и многие другие выдающиеся мастера слова. Такое созвездие столь мощных и самобытных талантов, столь знаменитых и трагических индивидуальностей, пожалуй, никогда еще не возникало на небосклоне русской литературы. В этой книге представлены наиболее яркие и значительные стихотворные строки самых известных представителей Серебряного века - символистов, акмеистов, футуристов, имажинистов, а также авторов, не связанных с каким-либо определенным направлением русского модернизма.",8 400 тг,0,Олма Медиа Групп,2019 г.,9785001114390,Твердый,15 мм,Неизвестно,Неизвестно,Неизвестно,http://www.bookcity.kz/content/images/thumbs/5133650_1465626.jpeg
Серебряный век. Лирика,Неизвестно,"В сборник поэзии СЕРЕБРЯНЫЙ ВЕК вошли лучшие и самые известные строки величайших русских поэтов, творивших в конце XIX - начале XX века. И.Анненский, К.Бальмонт, Н.Гумилев, А.Ахматова, Б.Пастернак, В.Маяковский, С.Есенин - эти и многие другие имена составляют славу русской литературы. И по сей день поэзия этих выдающихся творцов остается неповторимой и непревзойденной по красоте слога и высокой духовности.",1 800 тг,0,Эксмо,2015 г.,9785699788323,384,Твердый,165 мм x 120 мм,23 мм,300 г.,http://www.bookcity.kz/content/images/thumbs/5076008_1415268.jpeg
Сказания древней Японии,Сандзин С.,"""Сказания древней Японии"" - это не просто народные сказки, а настоящий памятник литературы, запечатлевший дух нации, миропонимание японского народа, своеобразие его мифологии и жизненного уклада. Составитель сборника японский писатель Садзанами Сандзин собрал рассеянные по различным источникам легенды и предания и изложил их современным языком. В книге представлено 24 увлекательных рассказа, которые можно подразделить на несколько групп: мифические - древнейшие, повествующие о японских божествах. легендарно-исторические - в них отражается становление и развитие японского государства. так называемые ""культурные"", где переданы этические и религиозные принципы японского народа, его представления о добре и зле, любви и чести, жизни и смерти. В причудливых сюжетах этих народных сказаний содержатся те основополагающие моменты, которые, развиваясь вместе с литературой и языком, составили своеобразие японской национальной прозы и поэзии. Эта уникальная книга вышла в переводе известного востоковеда В. Мендрина в начале XX века и с тех пор крайне редко переиздавалась, а между тем по своему содержанию будет интересна как детям среднего и старшего возраста, так и многочисленным взрослым поклонникам японской культуры. Книга иллюстрирована японской живописью и гравюрами, а также иллюстрациями из старого издания.",8 400 тг,0,Олма Медиа Групп,2018 г.,9785001112136,Твердый,15 мм,Неизвестно,Неизвестно,Неизвестно,http://www.bookcity.kz/content/images/thumbs/5133663_1465639.jpeg
Со мною вот что происходит...,Евтушенко Е.,"«Поэт в России – больше, чем поэт» – эти строчки из поэмы Евгения Александровича Евтушенко, знаменитого поэта–«шестидесятника», могли бы стать эпиграфом к его творчеству. Бунтарь, мечтатель, оратор и трибун, он восславил поэзию, которая бросилась «на приступ улиц», и был одним из тех, чье творчество явилось глотком свободы для многих людей. Столько прижизненной славы, сколько выпало на долю Евтушенко, мало кому доставалось. Он собирал многотысячные залы, завораживая слушателей напором эмоций и бьющей через край энергией. В своих стихах Евтушенко нашел ту интонацию, и те слова, благодаря которым стал голосом целой эпохи, а его лирика превратилась в «дневник века». Сегодня Евтушенко знают во всем мире, его произведения переведены более чем на семьдесят языков, а на его стихи написаны десятки песен («Хотят ли русские войны?», «Со мною вот что происходит…», «Ольховая сережка», «А снег повалится, повалится…», «Дай Бог!» и другие). В настоящее издание вошли избранные стихотворения Е. Евтушенко, созданные в разные годы жизни.",3 300 тг,0,Азбука-Аттикус,2018 г.,978538914858101,Твердый,Неизвестно,Неизвестно,Неизвестно,Неизвестно,http://www.bookcity.kz/content/images/thumbs/5133545_1465558.jpeg
Собрание сочинений в 6 томах,Блок А.А.,"Александр Блок - один из самых выдающихся представителей русского символизма, который оставил бесценное творческое наследие.",16 500 тг,0,Не указано,2009 г.,9785275018844,2800,Твердый,200 мм x 130 мм,23 мм,428 г.,http://www.bookcity.kz/content/images/thumbs/4955203_1323812.jpeg
