Доводы рассудка,Остин Д.,"""Чувство и чувствительность"", ""Гордость и предубеждение"", ""Мэнсфилд-парк"", ""Эмма"" - эти романы знаменитой писательницы Джейн Остин вдохновляли таких выдающихся мастеров английской литературы, как Ричард Олдингтон, Сомерсет Моэм и Вирджиния Вулф. Сегодня произведения Остин не перестают привлекать кинематографистов, по всему миру создаются музеи и литературные клубы ее имени. С тонкой иронией и мягким, истинно английским юмором писательница создала целую галерею ярких образов своих современников - благородных и коварных, безрассудных и малодушных, трепетных и высокомерных. В настоящем издании вниманию читателей представлен роман ""Доводы рассудка"", который вышел в свет в 1817 году, уже после смерти Остин. Главная героиня романа Энн Эллиот влюблена в бедного лейтенанта Уэн-тоурта, а ее семья находится на грани разорения. Ей предстоит принять трудное решение. Но чем же руководствоваться Энн: велением сердца или доводами рассудка?",1 200 тг,5,Азбука-Аттикус,2014 г.,978538902864703,272,Мягкий,15 мм,138 г.,Неизвестно,http://www.bookcity.kz/content/images/thumbs/2469681_1366893.jpeg
Дожить до рассвета,Быков В.В.,"""Автор самых пронзительных книг о войне"", ""самый читаемый белорусский автор во всем мире"", ""последний писатель реалистического толка Европы"" - всё это сказано о Василе Быкове, создателе знаменитых повестей ""Сотников"", ""Дожить до рассвета"", ""Пойти и не вернуться""… Произведения Быкова знаменовали в литературе новый этап осмысления военных событий, объединив в себе трагическую конкретику войны, ""окопную правду"", с ""вечными"" проблемами человеческого бытия. Как в бесчеловечных обстоятельствах сохранить человечность? Что спасать среди ужасов войны - тело или душу? Ради чего страдает человек, только ли для себя живет? На эти и другие вопросы ищут ответы герои Василя Быкова, выдающегося мастера военной прозы ХХ века.",1 300 тг,3,Азбука-Аттикус,2017 г.,9785389127265,480,Мягкий,19 мм,230 г.,Неизвестно,http://www.bookcity.kz/content/images/thumbs/5110314_1439167.jpeg
Доктор Живаго,Пастернак Б.Л.,"Знаковый для многих поколений, бывший долгие годы под запретом роман ""Доктор Живаго"" повествует о подлинной любви - свободной от преград, будоражащей воображение, разрушающей стереотипы, бесповоротно меняющей саму суть человеческого существования и не признающей никаких правил. К тому же этот роман стал верным психологическим свидетельством эпохи репрессий и притеснений личности. Пастернак был одним из немногих, кто ценой собственной судьбы не побоялся выступить в защиту свободы слова и совести.  Перед вами, пожалуй, одна из немногих книг, изменивших мир.",1 600 тг,0,Эксмо,2014 г.,9785699434916,704,Мягкий,26 мм,366 г.,Неизвестно,http://www.bookcity.kz/content/images/thumbs/5038341_1363568.jpeg
Доктор Живаго,Пастернак Б.Л.,"Этот роман - о любви, о России, о русской природе, о русской интеллигенции... Это роман обо всей нашей жизни. И он удивительно созвучен сегодняшнему дню.",4 000 тг,4,Эксмо,2015 г.,9785699702794,608,Твердый,200 мм x 130 мм,32 мм,140 г.,http://www.bookcity.kz/content/images/thumbs/5075213_1414497.jpeg
Доктор Живаго,Пастернак Б.Л.,"Борис Пастернак - лауреат Нобелевской премии, гениальный поэт, автор знаменитого романа ""Доктор Живаго"". ""Доктор Живаго"" стал в конце пятидесятых причиной грандиозного окололитературного скандала и, может быть, стоил поэту жизни. ""Я весь мир заставил плакать Над красой земли моей"", - написал о своей книге сам Пастернак. И добавим: не для того ли явлена миру история жизни и смерти Юрия Живаго, чтобы еще раз ""тайная струя страданья Согрела холод бытия""?",1 600 тг,5,Азбука-Аттикус,2015 г.,978538901724510,704,Мягкий,28 мм,343 г.,Неизвестно,http://www.bookcity.kz/content/images/thumbs/5060077_1400780.jpeg
Долина кукол,Сьюзанн Ж.,"Что для женщины счастье? Прежде всего — любовь. Но если нет любви, чем можно ее заменить? Деньгами, властью, славой? Три героини романа — три разные судьбы. Эти женщины добились в жизни многого: популярности, богатства, внимания знаменитых и успешных мужчин. Но что-то заставляет их искать забвения. А под рукой всегда есть таблетки — «куколки»,— которые уносят далеко-далеко, в мир сладких грез... 
Роман «Долина кукол» известной американской писательницы и актрисы Жаклин Сьюзан, вышедший в свет 1966 году, произвел настоящую сенсацию своими откровениями о жизни шоу-бизнеса и стал не только мировым бестселлером, но и поистине культовой книгой, продавшейся более чем 40 000 000 тиражом.",2 100 тг,5,Азбука-Аттикус,2019 г.,978538916474101,Мягкий,Неизвестно,Неизвестно,Неизвестно,Неизвестно,http://www.bookcity.kz/content/images/thumbs/5133452_1465473.jpeg
Дом духов,Альенде И.,"Исабель Альенде - одна из наиболее известных латиноамериканских писательниц, увенчана множеством премий и литературных званий. Начиная с первых романов ""Дом духов"" и ""Любовь и тьма"" литературные критики воспринимают ее как суперзвезду латиноамериканского магического реализма. Суммарный тираж ее книг уже перевалил за шестьдесят миллионов экземпляров, ее романы переведены на три десятка языков. В 2004 году ее приняли в Американскую академию искусств и литературы. Одна из самых знаменитых женщин Латинской Америки, она на равных общается с президентами и членами королевских домов, с далай-ламой, суперзвездами и нобелевскими лауреатами. «Дом духов» - это волнующее эпическое повествование об истории семьи Труэба. Здесь все реально и все волшебно, начиная с девушки с зелеными волосами, наделенной даром ясновидения: реальный пласт с уютом семейного дома, жизнью многострадальной страны, политическими бурями и тяжким трудом, стихией бунта, доверием, предательством, расстрелами, пытками, судьбой Поэта, за которой просматривается история певца Виктора Хары, и отражение этого зримого мира в волшебном зеркале предчувствий, роковых предсказаний, безумной страсти, которой не в силах помешать даже смерть.",1 400 тг,0,Азбука-Аттикус,2018 г.,978538915324001,512,Мягкий,34 мм,501 г.,Неизвестно,http://www.bookcity.kz/content/images/thumbs/5125154_1457728.jpeg
Дом Жизни,Россетти Д.Г.,"В книгу вошел знаменитый цикл сонетов ""Дом Жизни"", который критики сравнивают по значимости с сонетами У.Шекспира. Предлагаемое издание впервые столь полно знакомит русского читателя с творчеством Россетти-поэта. Помимо главного лирического достижения Россетти - цикла сонетов ""Дом жизни"", здесь представлены все сонеты и стихотворения, также вошедшие в последний прижизненный сборник поэта ""Баллады и сонеты"" (1881).",500 тг,5,Азбука-Аттикус,2007 г.,9785352016527,416,Мягкий,28 мм,203 г.,Неизвестно,http://www.bookcity.kz/content/images/thumbs/5009590_1331758.jpeg
Дом тишины,Памук О.,"Действие почти всех романов Орхана Памука происходит в Стамбуле, городе загадочном и прекрасном, пережившем высочайший расцвет и печальные сумерки упадка. Подобная двойственность часто находит свое отражение в характерах и судьбах героев, неспособных избавиться от прошлого, которое продолжает оказывать решающее влияние на их мысли и поступки. Таковы герои второго романа Памука «Дом тишины», по мастерству и эмоциональной силе напоминающего «Сто лет одиночества» Маркеса и «Дети Полуночи» Рушди. Перед читателем неспешно разворачивается история одной стамбульской семьи, рассказанная от лица различных ее представителей, каждый из которых заключен в свой собственный дом тишины, наполненный невысказанными мечтами и тревожными размышлениями о прошлом.",1 600 тг,0,Азбука-Аттикус,2017 г.,9785389123236,352,Мягкий,17 мм,175 г.,Неизвестно,http://www.bookcity.kz/content/images/thumbs/5119074_1434532.jpeg
Дом у кладбища,Ле Фаню Д.Ш.,"Джозеф Шеридан Ле Фаню – выдающийся писатель Викторианской эпохи, в которую его нередко именовали «ирландским Уилки Коллинзом» и «ирландским Эдгаром По», создатель знаменитой повести «Кармилла» и множества готических рассказов и романов, переживших на рубеже XIX–XX веков временное забвение, а затем повторно завоевавших популярность – уже у новых поколений читателей. Действие романа «Дом у кладбища» (1862, опубл. 1863), который сам Ле Фаню считал вершиной своего творчества, разворачивается в деревушке Чейплизод неподалеку от Дублина, и начинается с находки на местном погосте останков человека, явно умершего насильственной смертью.еки многих событий и поступков усложняет психологический мир романа и обостряет драматизм его сюжетных коллизий.",1 600 тг,0,Азбука-Аттикус,2017 г.,978538913589501,704,Мягкий,31 мм,325 г.,Неизвестно,http://www.bookcity.kz/content/images/thumbs/5108482_1444765.jpeg
Домашний быт русских царей в XVI и XVII столетиях,Забелин И.Е.,"Одно из лучших произведений русского историка И.Е.Забелина ""Домашний быт русских царей"" открывает для нас сокровенные и важные для понимания исторического прошлого детали жизни государева двора. Читая эту книгу, мы имеем возможность познакомиться с историей возникновения, постройки и переоборудования царского дворца, с его внутренним и внешним убранством, с дворцовыми порядками и ритуалами. Эта книга будет интересна и полезна всем любителям российской истории.",900 тг,0,Эксмо,2008 г.,9785699312771,482,Твердый,200 мм x 130 мм,29 мм,407 г.,http://www.bookcity.kz/content/images/thumbs/5048369_1370552.jpeg
Домострой. Юности честное зерцало,Неизвестно,"В настоящем издании публикуются два памятника русской литературы - ""Домострой"" и ""Юности честное зерцало"", два самых известных этикетно-бытовых текста, содержащих советы на все случаи жизни: какими должны быть отношения между родителями и детьми, как вести себя в церкви, как принимать гостей, как правильно держать себя за столом, как обращаться со слугами и т. д. Эти учебники житейской мудрости неизменно вызывают читательский интерес. ""Домострой"", созданный в XVI веке, стал символом старой Московии ""Юности честное зерцало"" (XVIII в.) изображает общественную и домашнюю жизнь человека в новой - петровской России. Они взаимно дополняют и освещают друг друга, прекрасно прочерчивая исторический путь России и исторический опыт минувших столетий.",500 тг,5,Азбука-Аттикус,2008 г.,9785911817459,208,Мягкий,12 мм,108 г.,"

                                                Предисловие, Домострой, Юности честное зерцало, или Показание к житейскому обхождению, собранное от разных авторов",http://www.bookcity.kz/content/images/thumbs/5019383_1340342.jpeg
Дон-Жуан,Байрон Д.Г.,"ДОН-ЖУАН - итоговое произведение великого английского поэта Байрона с уникальным для него - не ""байроническим""! - героем. На смену одиноким страдальцам наподобие Чайльд-Гарольда приходит беззаботный повеса, влекомый собственными страстями. Они заносят его и в гарем, и в войска под командованием Суворова, и ко двору Екатерины II... ""В разнообразии тем подобный самому Шекспиру (с этим согласятся люди, читавшие его ДОН-ЖУАНА), - писал Вальтер Скотт о Байроне, - он охватывал все стороны человеческой жизни... Ни ""Чайльд-Гарольд"", ни прекрасные ранние поэмы Байрона не содержат поэтических отрывков более восхитительных, чем те, какие разбросаны в песнях ДОН-ЖУАНА...""",1 500 тг,3,Азбука-Аттикус,2016 г.,978538908472801,576,Мягкий,25 мм,270 г.,Неизвестно,http://www.bookcity.kz/content/images/thumbs/5098893_1434203.jpeg
Дориан,Селф У.,"""Дориан"" - это книга о нравственном преступлении и о цене за него, о соотношении искусства и действительности, искусства и морали. Классический сюжет Оскара Уайльда перенесен в современную действительность: художник Холлуорд создает великолепную видеоинсталляцию, в центре которой - молодой красавец Дориан Грей, и дарит ее герою. Грей отправляется в бесконечный ""загул"": ведет самый беспутный и безнравственный образ жизни, какой только можно себе представить. Проходят десятилетия, а герой остается молодыми прекрасным, зато день ото дня меняется его видеодвойник становясь все безобразнее. Впрочем, катастрофа все равно неизбежна, а возмездие - неотвратимо...",1 500 тг,0,Иностранка,2005 г.,9785941453498,400,Твердый,195 мм x 130 мм,24 мм,318 г.,http://www.bookcity.kz/content/images/thumbs/5041304_1363900.jpeg
Дорога,Маккарти К.,"После катастрофы Отец и Сын идут через выжженные земли, пересекая континент. Всю книгу пронизывают глубокие, ранящие в самое сердце вопросы. Есть ли смысл жить, если будущего — нет? Вообще нет. Есть ли смысл жить ради детей? Это роман о том, что все в жизни относительно, что такие понятия, как добро и зло, в определенных условиях перестают работать и теряют смысл. Это роман о том, что действительно важно в жизни, и о том, как это ценить. И это также роман о смерти, о том, что все когда-нибудь кончается, и поэтому нужно каждый день принимать таким, какой есть. Нужно просто... жить.",1 600 тг,5,Азбука-Аттикус,2014 г.,978538908495707,256,Мягкий,165 мм x 120 мм,17 мм,130 г.,http://www.bookcity.kz/content/images/thumbs/5092238_1430165.jpeg
Дороги судьбы,О.Генри,"О. Генри - выдающийся американский новеллист начала ХХ века, прославившийся блестящими юмористическими рассказами, мастер неожиданных сравнений и непредвиденных, парадоксальных развязок. Художественная выразительность в сочетании с тонкой наблюдательностью, живость и сжатость повествования, неиссякаемое остроумие, любовь к людям - вот что принесло О. Генри славу и признание многих поколений читателей. В настоящее издание вошли такие известные рассказы, как ""Дороги судьбы"", ""Сила привычки"", ""Погребок и роза"", ""Волшебный профиль"" и многие другие.",1 300 тг,5,Азбука-Аттикус,2018 г.,9785389145665,416,Мягкий,1 мм,501 г.,Неизвестно,http://www.bookcity.kz/content/images/thumbs/5119385_1452239.jpeg
Дороже самой жизни,Манро Э.,"Вот уже более тридцати лет Элис Манро называют лучшим в мире автором коротких рассказов, но к российскому читателю ее книги пришли только теперь, после того, как писательница получила Нобелевскую премию по литературе. Критика постоянно сравнивает Манро с Чеховым, и это сравнение не лишено оснований: подобно русскому писателю, она умеет рассказать историю так, что читатели, даже принадлежащие к совсем другой культуре, узнают в героях самих себя. В сборнике, «Дороже самой жизни», Манро опять вдыхает в героев настоящую жизнь со всеми ее изъянами и нюансами. Самое сильное оружие в арсенале Манро — умение сочувствовать персонажам, и здесь она снова демонстрирует его в полном объеме.",1 400 тг,0,Азбука-Аттикус,2018 г.,9785389157651,Мягкий,15 мм,Неизвестно,Неизвестно,Неизвестно,http://www.bookcity.kz/content/images/thumbs/5129040_1461502.jpeg
