Рыжеволосая Женщина,Памук О.,"Последний роман Орхана Памука рассказывает историю любви, случившуюся в небольшом городке недалеко от Стамбула. Главный герой книги — юный стамбульский лицеист, полюбивший актрису бродячего театра, загадочную Рыжеволосую Женщину, которая каждую ночь рассказывает немногочисленной публике старинные сказки и предания. Впервые познав опьянение любовью, ревность, ощущение свободы и ответственности, Джем Челик пронесет эти чувства через всю жизнь, чтобы через тридцать лет вновь встретиться со своим прошлым лицом к лицу...",1 300 тг,1,Азбука-Аттикус,2018 г.,9785389144026,Мягкий,15 мм,Неизвестно,Неизвестно,Неизвестно,http://www.bookcity.kz/content/images/thumbs/5126666_1459167.jpeg
Рэт Скэбис и Святой Грааль,Дейвс К.,"Погоня за Святым Граалем начинается!  Эта таинственная реликвия не досталась еще никому из правителей - от короля Артура до Адольфа Гитлера.  Что это значит?  То, что Святой Грааль обязан достаться Рэту Скэбису и его другу и летописцу Крису Дейвсу!  Правда, у рыцарей-тамплиеров, черных магов, наследников династии Меровингов и Агентов ЦРУ есть на этот счет несколько другое мнение... но кто их спрашивает?  Нет в этом мире силы, равной силе панк-рока!",500 тг,0,АСТ,2007 г.,9785170390571,352,Твердый,200 мм x 130 мм,24 мм,336 г.,http://www.bookcity.kz/content/images/thumbs/5019646_1340479.jpeg
Сага о Форсайтах. В 2-х книгах,Голсуорси Д.                                                           ,"""За высокое искусство повествования, вершиной которого является ""Сага о Форсайтах"""", классик английской литературы Джон Голсуорси стал лауреатом Нобелевской премии. Его популярнейший цикл романов, воссоздающий историю клана Форсайтов на фоне истории Англии, от Викторианской эпохи до 1920-х гг., написан о семье и о жизни во всей ее полноте и сложности.",3 400 тг,0,Азбука-Аттикус,2018 г.,978538905829302,1792,Мягкий,180 мм x 115 мм,35 мм,845 г.,http://www.bookcity.kz/content/images/thumbs/5064569_1404769.jpeg
Сайонара,Баркер С.,"Бар ""Сайонара"". Обычное токийское заведение средней руки, где пересекаются пути пожилого вдовца и странной девушки, одержимой призраком его покойной жены, наивной англичанки и ее ""гнусного соблазнителя"" якудза, тихого юного повара, обладающего мощными парапсихологическими способностями, хищной ""фам-фаталь"" из Восточной Европы и ""таинственного мстителя"" с изуродованным лицом. Бар ""Сайонара"". Здесь подается крепкий коктейль под названием ""Нечего терять""!",500 тг,4,АСТ,2006 г.,9785170370863,352,200 мм x 130 мм,21 мм,Неизвестно,Неизвестно,http://www.bookcity.kz/content/images/thumbs/5021305_1340717.jpeg
Самоубийца,Эрдман Н.Р.,"Драматург Николай Робертович Эрдман (1900-1970) известен как автор двух пьес: ""Мандат"" и ""Самоубийца"". Первая - принесла начинающему автору сенсационный успех и оглушительную популярность, вторая - запрещена советской цензурой. Только в 1990 году Ю. Любимов поставил ""Самоубийцу"" в Театре на Таганке. Острая сатира и драматический пафос произведений Н.Р. Эрдмана произвели настоящую революцию в российской драматургии 20-30-х гг. прошлого века, но не спасли автора от сталинских репрессий. Абсурд советской действительности, бюрократическая глупость, убогость мещанского быта и полное пренебрежение к человеческой личности - темы сатирических комедий Н.Эрдмана вполне актуальны и для современной России. Помимо пьес, в сборник вошли стихотворения Эрдмана-имажиниста, его басни, интермедии, а также искренняя и трогательная переписка с известной русской актрисой А.Степановой.",900 тг,0,Эксмо,2007 г.,9785699226566,544,Твердый,200 мм x 130 мм,30 мм,453 г.,http://www.bookcity.kz/content/images/thumbs/5009911_1331276.jpeg
Санин,Арцыбашев М.П.,"Михаил Арцыбашев - один из самых популярных беллетристов начала XX века, чье творчество многие годы подвергалось жестокой критике и лишь сравнительно недавно получило заслуженное признание. Роман ""Санин"" - главная книга писателя - долгое время носил клеймо ""порнографического романа"", переполошил читающую Россию и стал известным во всем мире. Тонкая, деликатная сфера интимных чувств нашла в Арцыбашеве своего сильного художника. ""У Арцыбашева и талант, и содержание"", - писал Л.Н.Толстой. Помимо романа ""Санин"", в книгу вошли повести и рассказы: ""Роман маленькой женщины"", ""Кровавое пятно"", ""Старая история"" и другие.",900 тг,0,Не указано,2008 г.,9785699273362,640,Твердый,200 мм x 130 мм,30 мм,"

                                                Санин, Повести и рассказы, Паша Туманов, Бог, Смех, Из подвала, Тени утра, Роман маленькой женщины, Кровавое пятно, Человеческая волна, Революционер, Старая история, Деревянный чурбан",http://www.bookcity.kz/content/images/thumbs/5034709_1356717.jpeg
Санин,Арцыбашев М.П.,"В начале XX века Михаил Арцыбашев был едва ли не самым известным писателем в России, и своей литературной славой он был обязан роману «Санин».  Книга вышла в 1907 году и имела оглушительный успех у читателей. За Арцыбашевым закрепился статус «властителя дум» и борца с мертвыми нормами морали. Образ главного героя, призывавшего радоваться жизни, удовлетворяя свои «естественные желания», оказался на удивление созвучным времени. По всей России создавались кружки «санинцев»  и лиги свободной любви, в то время как в критике вокруг романа велись ожесточенные споры между его сторонниками и противниками. В советские годы произведения Арцыбашева не публиковались, и его имя было незаслуженно забыто. Между тем творчество Арцыбашева, безусловно, являет собой одну из самых ярких страниц в литературе Серебряного века и будет интересно всем, кто увлекается историей русской культуры.",1 300 тг,0,Азбука-Аттикус,2018 г.,978538914241101,352,Мягкий,16 мм,501 г.,Неизвестно,http://www.bookcity.kz/content/images/thumbs/5117092_1450010.jpeg
Сатори в Париже. Тристесса,Керуак Д.,"Еще при жизни Керуака провозгласили «королем битников», но он неизменно отказывался от этого титула. Все его творчество, послужившее катализатором контркультуры, пронизано желанием вырваться на свободу из общественных шаблонов, найти в жизни смысл. Поиски эти приводили к тому, что он то испытывал свой организм и психику на износ, то принимался осваивать духовные учения, в первую очередь буддизм, то путешествовал по стране и миру. Таким путешествиям посвящены и предлагающиеся вашему вниманию повести. В Париж Керуак поехал искать свои корни, исследовать генеалогию — а обрел просветление в Мексику он поехал навестить Уильяма Берроуза — а встретил там девушку сложной судьбы, по имени Тристесса…",1 200 тг,5,Азбука-Аттикус,2015 г.,9785389102200,192,Мягкий,15 мм,105 г.,"

                                                Сатори в Париже, Тристесса",http://www.bookcity.kz/content/images/thumbs/5082988_1422124.jpeg
Свадьба Кречинского,Сухово-Кобылин А.В.,"Александра Васильевича Сухово-Кобылина ( 1817—1903) заслуженно считают одним из самых талантливых драматургов-сатириков, хотя его перу и принадлежат всего три пьесы – трилогия «Свадьба Кречинского», «Дело» и «Смерть Тарелкина». Александр Васильевич с юных лет пристрастился к литературе и философии, однако обратиться к литературной деятельности его заставили трагические обстоятельства. Писатель был обвинен в смерти своей возлюбленной, Луизы Симон-Деманш, и находился под следствием семь лет. Скорбь от потери, негодование на несправедливое обвинение, переживания, связанные с чиновничьим произволом и судебным процессом, нашли отражение в его знаменитой трилогии.",900 тг,0,Не указано,2007 г.,9785699205448,Твердый,26 мм,391 г.,Неизвестно,Неизвестно,http://www.bookcity.kz/content/images/thumbs/5030475_1352281.jpeg
Свеча горела,Пастернак Б.Л.,"В настоящее издание вошло основное собрание лирических произведений великого русского поэта, лауреата Нобелевской премии Бориса Леонидовича Пастернака: девять поэтических книг, включая стихотворения из романа ""Доктор Живаго"", а также автобиографический очерк ""Люди и положения"". Каким бы сложным ни был путь поэта - от ""высокого косноязычия"" ранних ""неистовых"" стихов к ""ошеломляющей простоте"" поздней лирики, - для многих поколений читателей он был и остается любимым и значительным, как чистый звук в оглушающем шуме своей эпохи. По словам Цветаевой, у Пастернака никогда не будет ""площади"". Но будет ""множество одиноких, одинокое множество жаждущих, которых он, уединенный родник, поит"".",1 500 тг,3,Азбука-Аттикус,2017 г.,978538912317501,480,Мягкий,20 мм,290 г.,Неизвестно,http://www.bookcity.kz/content/images/thumbs/5111746_1435340.jpeg
Свидание в аду,Дрюон М.,"Мориса Дрюона читающая публика знает прежде всего по саге «Проклятые короли», открывшей мрачные тайны средневековья, и роману-трилогии «Конец людей», рассказывающей о закулисье современного общества, о закате династии финансистов и промышленников. Эта трилогия наиболее значительное произведение Дрюона, лауреата Гонкуровской премии. Третий роман цикла называется «Свидание в аду». О богатстве и могуществе семьи Шудлеров и де ла Моннери напоминают лишь громкие титулы и стосковавшийся по ремонту родовой замок. В наследство Мари Анж и Жан Ноэлю достались не завещанные миллионы, а бремя дряхлеющего клана, бесхарактерность и малодушие. Как выдержать ад общения с любящими людьми? К тому же, по замечанию одного из героев романа, «каждый таит в себе свой собственный ад»…",1 300 тг,2,Азбука-Аттикус,2016 г.,9785389109599,352,Мягкий,15 мм,180 г.,Неизвестно,http://www.bookcity.kz/content/images/thumbs/5084061_1423056.jpeg
Свидание с Бонапартом,Окуджава Б.Ш.,"Исторический роман СВИДАНИЕ С БОНАПАРТОМ Булат Окуджава неоднократно называл своим лучшим произведением. События Отечественной войны 1812 года представлены сквозь воспоминания, биографии и дневники разнообразных персонажей: членов семей Опочининых и Волковых, французской певицы Луизы Бигар, австрийского эмигранта и французского интенданта. Эта разноголосица музыкальна, увлекательна и своеобразна. Именно так - из поэзии, музыки и воображения - рождается историческая правда, к которой оказываются причастными не только участники былых событий, но и современный читатель, отдающий должное удивительному таланту Булата Окуджавы.",1 200 тг,0,Азбука-Аттикус,2014 г.,978538907541201,352,Мягкий,15 мм,170 г.,Неизвестно,http://www.bookcity.kz/content/images/thumbs/5069425_1409065.jpeg
Священная книга оборотня,Пелевин В.,"А Хули — древнекитайская лиса-оборотень, ей две тысячи лет. Она не просто рассказывает историю своей жизни в Москве среди бесхвостых обезьян, но пишет Священную Книгу: ""Как считается, в ней будет раскрыта главная тайна оборотней. Каждый оборотень, который ее прочитает, сумеет пять раз понять эту тайну"". А Хули — мастер иллюзий, но однажды она встречает того, кто неподвластен ее гипнозу: волка-оборотня с удостоверением ФСБ...",1 700 тг,4,Азбука-Аттикус,2015 г.,9785389104563,384,Мягкий,15 мм,190 г.,Неизвестно,http://www.bookcity.kz/content/images/thumbs/5116074_1449025.jpeg
Север и Юг,Гаскелл Э.,"В настоящем издании впервые на русском языке публикуется роман Элизабет Гаскелл ""Север и Юг"" - история любви, рассказанная в лучших традициях викторианской литературы. До сих пор почитатели творчества Элизабет Гаскелл в России имели возможность познакомиться с этим романом только по прекрасной экранизации ВВС 2004 года. Главная героиня, уроженка Южной Англии Маргарет Хейл, вынуждена переехать в северные промышленные районы. Впечатлительная девушка глубоко возмущена ужасными условиями, в которых живут рабочие, однако ее негодование против владельца фабрики Джона Торнтона невольно перерастает в нежное чувство. Героям на протяжении романа приходится преодолевать множество предрассудков, учиться более широко и полно видеть мир, не деля его на черное и белое, на север и юг, учиться доброте и человечности.",1 400 тг,2,Азбука-Аттикус,2015 г.,978538902209606,544,Мягкий,22 мм,263 г.,Неизвестно,http://www.bookcity.kz/content/images/thumbs/2691786_1354075.jpeg
Севильский обольститель.Дон Жуан в испанской литератературе,Неизвестно,"Дон Жуан - самый желанный гость мировой литературы: похождения сердцееда и дуэлянта так и просятся на бумагу, в какой бы стране ни происходили. Но все же родился соблазнитель тысячи и трех женщин в Испании, и его настоящее имя Дон Хуан. В сборник включены наиболее знаменитые и интересные произведения в испанской литературе, посвященные Дон Жуану (Дон Хуану). За пять веков существования легенды о нем этот герой претерпел множество изменений.",1 200 тг,0,Азбука-Аттикус,2009 г.,978599850065701,352,Мягкий,18 мм,Неизвестно,Неизвестно,http://www.bookcity.kz/content/images/thumbs/5017206_1340955.jpeg
Севильский цирюльник,Бомарше П.,"""Севильский цирюльник"" (1775) и ""Женитьба Фигаро"" (1784) - две бессмертные комедии, ставшие вершиной творчества Бомарше-драматурга. Написанные в преддверии Великой французской революции, они вот уже свыше двух столетий не сходят со сцены. Их сюжеты легли в основу либретто опер Дж.Россини и В.А.Моцарта.",1 400 тг,3,Азбука-Аттикус,2011 г.,978538902978102,304,Мягкий,17 мм,151 г.,"

                                                Севильский цирюльник, или Тщетная предосторожность, Безумный день, или Женитьба Фигаро",http://www.bookcity.kz/content/images/thumbs/5010416_1330537.jpeg
"Седьмое Правило Волшебника, или Столпы творения",Гудкайнд Т.,"Зло становится все сильнее, все могущественнее... Слишком черны людские души, слишком многие мечтают о власти и богатстве - и готовы, во имя достижения собственной цели, служить любому господину. Даже - Сноходцу Джеганю, чья армия захватывает все новые и новые земли - и почти не встречает сопротивления... Кто окажется столь чист душой, что не поверит в заманчивые посулы Тьмы? Только - юная сестра легендарного Ричарда Сайфера Дженнсен. Единственная, кому удалось ускользнуть от клинков наемных убийц. Та, перед которой лежит полный опасностей путь в сердце Д'Хары - ибо только там сможет она познать Седьмое Правило Волшебника...",4 000 тг,4,АСТ,2005 г.,9785170303144,608,Твердый,215 мм x 145 мм,28 мм,670 г.,http://www.bookcity.kz/content/images/thumbs/5058073_1350999.jpeg
Секс и страх,Киньяр П.,"Эссе ""Секс и страх"" - едва ли не самое нашумевшее произведение П.Киньяра, блистательного французского прозаика, эссеиста, переводчика. Автор рассказывает о роли эроса - ""архаического, предчеловеческого, абсолютно животного"" начала в культуре античности.",600 тг,3,Азбука-Аттикус,2007 г.,9785352008096,256,Мягкий,13 мм,147 г.,Неизвестно,http://www.bookcity.kz/content/images/thumbs/5009523_1330608.jpeg
