"Моби Дик, или Белый Кит",Мелвилл Г.,"""Моби Дик"" Германа Мелвилла считается самым великим американским романом XIX века. В центре этого уникального, написанного вопреки законам жанра произведения - погоня за Белым китом. Захватывающий сюжет, эпические морские картины, описания ярких человеческих характеров в гармоничном сочетании с самыми универсальными философскими обобщениями делают эту книгу подлинным шедевром мировой литературы. Комментарии И.Бернштейн.",1 700 тг,4,Азбука-Аттикус,2012 г.,978538904184406,704,Мягкий,27 мм,333 г.,Неизвестно,http://www.bookcity.kz/content/images/thumbs/5069432_1409071.jpeg
"Моби Дик, или Белый Кит",Мелвилл Г.,"Одна из лучших книг о судьбе и неизбежном роке, фатуме. Песнь печали и трагедии. Брызги соленой воды на лице, скрежет мачт и порывы ледяного ветра врываются в действительность со страниц романа. Пекод до сих пор плывёт по океану людских скорбей со своей командой выродков, ублюдков и людоедов, ища самое страшное чудовище, обитающее во вселенной. Страх - имя ему. Чтобы убить его в самих себе. Нет лучшей судьбы, большей доблести и большей чести. Отвага, перед которой мерк­нут герои Гомера. Песнь о страдании человеческой души, пробирающая до костей, до мурашек по коже.",3 700 тг,5,Эксмо,2017 г.,9785699984466,640,Твердый,33 мм,570 г.,Неизвестно,http://www.bookcity.kz/content/images/thumbs/5106286_1442648.jpeg
"Моби Дик, или Белый Кит",Мелвилл Г.,"Эпопея об опасной охоте на гигантского Белого Кита, Моби Дика, — широко известное произведение американского писателя, моряка и путешественника Германа Мелвилла. По всем морям ищет Моби Дика отважный капитан китобойного судна Ахав, лишившийся ноги в схватке с Белым Китом. Брызги соленой воды на лице, скрежет мачт и порывы ледяного ветра врываются в действительность со страниц романа. ""Моби Дик"" — это погружение в самый настоящий океан с неизмеримой глубиной, суровым ветром, штормами и периодами обманчивого спокойствия.",1 800 тг,5,Эксмо,2019 г.,9785041041267,Мягкий,32 мм,Неизвестно,Неизвестно,Неизвестно,http://www.bookcity.kz/content/images/thumbs/5133521_1465535.jpeg
Мои скитания,Гиляровский В.А.,"Владимир Алексеевич Гиляровский — замечательный русский писатель, журналист, легенда Москвы и ее бытописатель, автор знаменитой книги ""Москва и москвичи"". За доброту и отзывчивость его называли ""дядей Гиляем"", за талант журналиста — ""королем репортажа"". В своих статьях, очерках и книгах Гиляровский запечатлел русскую повседневную жизнь второй половины XIX — начала ХХ века: память о прошлом России сохранилась благодаря этим бесценным свидетельствам очевидца. Свою первую книгу (""Трущобные люди"") Гиляровский составил из рассказов и очерков, уже публиковавшихся в газетах и журналах, однако книга была запрещена цензурой (""такую правду печатать нельзя""). Сам Гиляровский называл своим любимым произведением повесть ""Мои скитания"" (1928), где увлекательно и ярко рассказал о пережитом — о радостях и горестях, испытаниях, встречах.",1 400 тг,0,Азбука-Аттикус,2015 г.,978538908961701,416,Мягкий,17 мм,205 г.,Неизвестно,http://www.bookcity.kz/content/images/thumbs/5075946_1415204.jpeg
Мои странные мысли,Памук О.,"Орхан Памук – известный турецкий писатель, обладатель многочисленных национальных и международных премий, в числе которых Нобелевская премия по литературе за «поиск души своего меланхолического города». Новый роман Памука «Мои странные мысли», над которым он работал последние шесть лет, возможно, самый «стамбульский» из всех. Его действие охватывает более сорока лет – с 1969 по 2012 годы. Главный герой Мевлют работает на улицах Стамбула, наблюдая как улицы наполняются новыми людьми, город обретает и теряет новые и старые здания, из Анатолии приезжают на заработки бедняки. На его глазах совершаются перевороты, власти сменяют друг друга, а Мевлют все бродит по улицам, зимними вечерами задаваясь вопросом, что же отличает его от других людей, почему его посещают странные мысли обо всем на свете и кто же на самом деле его возлюбленная, которой он пишет письма последние три года.",1 700 тг,0,Азбука-Аттикус,2017 г.,9785389130449,Мягкий,Неизвестно,Неизвестно,Неизвестно,Неизвестно,http://www.bookcity.kz/content/images/thumbs/5133564_1465576.jpeg
Мой друг Иван Лапшин,Герман Ю.П.,"Милицейская тема в литературе — опасная тема. Не у многих авторов выходит что-либо стоящее при работе с ней. Опасная она потому, что очень просто скатиться в беготню за преступниками и забыть за этим о человеке. У Юрия Германа это получилось, как получилось у Павла Нилина в «Испытательном сроке» и «Жестокости», в «Мухтаре» у Израиля Меттера, у братьев Вайнеров в «Эре милосердия». Любая тема, милицейская она или нет, не должна для писателя затмевать главное: пишешь не о профессии, пишешь о человеке, в какую бы одежду ты его ни одел — в милицейскую ли шинель, в военную гимнастерку, халат врача или же в бушлат лагерника. А профессия — она приложение. Прообразом главного героя двух ранних повестей Юрия Германа, составивших основу этого сборника, стал легендарный «сыщик» Иван Васильевич Бодунов, гроза преступного мира Ленинграда 1920—1930-х годов.",1 500 тг,0,Азбука-Аттикус,2019 г.,978538916107801,Мягкий,10 мм,Неизвестно,Неизвестно,Неизвестно,http://www.bookcity.kz/content/images/thumbs/5130458_1462879.jpeg
Мой мальчик,Хорнби Н.,"Не каждому удается сохранить в себе хотя бы частицу детства. Особенно если жизнь вокруг делает все возможное, чтобы превратить тебя в стадное существо или в абсолютного эгоиста, воспринимающего мир как фантом. Великовозрастный бездельник Уилл как раз из такой породы. Так бы он и летел по жизни, как растение перекати-поле, если бы не встретил однажды мальчика по имени Маркус и эта встреча не вернула Уиллу забытое ощущение детства.",1 200 тг,0,Азбука-Аттикус,2014 г.,9785389090590,320,Мягкий,14 мм,155 г.,Неизвестно,http://www.bookcity.kz/content/images/thumbs/5064955_1405186.jpeg
Моление о птице,Слепакова Н.,Вашему вниманию предлагается сборник стихотворений Нонны Слепаковой.,500 тг,5,Азбука-Аттикус,2011 г.,9785389018709,256,Мягкий,17 мм,Неизвестно,Неизвестно,http://www.bookcity.kz/content/images/thumbs/5069427_1409067.jpeg
Молот ведьм,"Крамер Г., Шпренгер Я.","«Молот ведьм» — легендарная книга Средневековья, трактат о ведьмах, чертях и дьяволе и, вместе с тем, руководство к действию, призыв уничтожать, искоренять, стирать с лица земли всех рабов, поклонников и верных служителей сатаны. Редкая книга сравнится с «Молотом ведьм» по стилю, убедительности и той мрачной роли, которой пришлось сыграть ей в истории человеческой глупости и мракобесия. Не будет преувеличением сказать, что каждая страница этой книги написана кровью многочисленных жертв. Здесь можно найти ответы на самые немыслимые вопросы, например «Могут ли черти рожать людей?», «Как отличить служанку сатаны от христианской девушки?», а также узнать в подробностях, как проходили знаменитые процессы над ведьмами. Книга безусловно не потеряла своей актуальности и читается с неослабевающим вниманием по сей день.",1 400 тг,4,Азбука-Аттикус,2018 г.,9785389149731,384,Мягкий,1 мм,501 г.,Неизвестно,http://www.bookcity.kz/content/images/thumbs/5121669_1454432.jpeg
Молчание,Андреев Л.Н.,"Леонида Андреева современники называли «сфинксом российской интеллигенции». По сей день он остается одним из самых неразгаданных авторов начала ХХ века. Его произведения, провокационные, парадоксальные, «хулиганские», потрясли всю читающую Россию. По словам Корнея Чуковского, «он любил все огромное» — масштабные темы, проблемы, образы. Интеллектуальной опорой творчества Андреева стали произведения А Шопенгауэра, Ф Ницше, Ф. Достоевского, а квинтэссенцией настроений — трагедия одинокой личности, которая, потеряв веру в Бога, оказалась перед пугающей пустотой. Андреев завораживает читателей, раскрывая перед ними самые темные, самые мрачные закоулки человеческой души придуманные им сюжеты навсегда врезаются в память. В настоящее издание вошли наиболее известные рассказы и повести Л. Андреева, такие как «Баргамот и Гараська», «Молчание», «Бездна», «Жизнь Василия Фивейского», «Красный смех», «Рассказ о семи повешенных» и др.",1 500 тг,1,Азбука-Аттикус,2018 г.,9785389155107,512,Мягкий,1 мм,501 г.,Неизвестно,http://www.bookcity.kz/content/images/thumbs/5124937_1457531.jpeg
Монахиня,Дидро Д.,"Выдающийся писатель и мыслитель эпохи Просвещения Дени Дидро известен, прежде всего, как издатель знаменитой ""Энциклопедии, или Толкового словаря наук, искусств и ремесел"". Его первый роман ""Нескромные сокровища"" был создан в течение двух недель: писатель заключил пари с собственной любовницей, что эротические романы сочинять нетрудно. Так появилось увлекательное и забавное повествование, составившее примечательную страницу в истории французского галантного романа.Однако и в последующих произведениях Дидро - философских романах-диалогах ""Жак-фаталист"" и ""Племянник Рамо"" и, конечно, его романе-исповеди ""Монахиня"" - сильна эротическая составляющая. Тема эроса окрашивает реалистический с явно антиклерикальным разоблачительным оттенком текст ""Монахини"".",500 тг,5,Азбука-Аттикус,2006 г.,9785911810085,Мягкий,12 мм,144 г.,Неизвестно,Неизвестно,http://www.bookcity.kz/content/images/thumbs/5048728_1369284.jpeg
Монт-Ориоль,Ги де Мопассан,"Ги де Мопассан был и остается одним из самых читаемых и любимых французских авторов. На его книгах выросли поколения читателей. Благодаря роману ""Милый друг"" они открывали для себя мир запретной эротики. Роман ""Жизнь"", который Л.Н.Толстой оценил как ""едва ли не лучший французский роман со времен ""Отверженных"" Гюго"", рассказывал им об утраченных иллюзиях.   Психологический роман Мопассана ""Монт-Ориоль"", предлагаемый вниманию читателя, по словам автора, основан на ""истории страсти очень живой и очень поэтической"". В центре сюжета зарождение, нарастание и неизбежный закат любви прелестной и трогательной Христианы Андерматт. История утраты иллюзий разворачивается на фоне мошеннической аферы - организации модного курорта, где предприниматели и заинтересованные в расширении клиентуры врачи обманывают больных.",1 000 тг,1,Азбука-Аттикус,2011 г.,9785389023505,320,Мягкий,14 мм,153 г.,Неизвестно,http://www.bookcity.kz/content/images/thumbs/5118736_1451610.jpeg
"Море, море",Мердок А.,"Классический, удостоенный Букеровской премии роман ""самой английской писательницы"" XX века, одна из вершин психологической прозы автора. Герой книги Чарлз Эрроуби, режиссер, немного актер и немного драматург, уходит на покой в зените славы. Он отрекается от волшебства театра, чтобы стать отшельником. Правда, он - отшельник-сибарит и живет не в пещере, а в комфортабельной вилле на берегу моря. Профессионал до мозга костей, Эрроуби и здесь не может отказать себе в удовольствии срежиссировать жизнь окружающих его людей в прекрасных декорациях морского пейзажа. ""Море, море"" - роман о море страстей человеческих.",1 500 тг,5,Азбука-Аттикус,2016 г.,978538911641201,Мягкий,23 мм,Неизвестно,Неизвестно,Неизвестно,http://www.bookcity.kz/content/images/thumbs/5130066_1462460.jpeg
Морской волк,Лондон Д. ,"Величественность природы, непоколебимая сила духа человека, любовь к жизни и неизменная искренность рассказа сделали произведения Лондона любимыми и востребованными вот уже у нескольких поколений читателей. Суровая романтика приключений соседствует в его книгах с размышлениями о самых глубоких, извечных вопросах человеческого бытия. В романе ""Морской волк"" противоречивая фигура Волка Ларсена, капитана промысловой шхуны, жестокого и циничного моряка, способного легко убить человека - но вместе с тем одинокого философа, поклонника Теннисона и Шекспира - раскрывается на фоне описанных с большим мастерством и любовью опасных морских странствий. В увлекательных рассказах о золотой лихорадке Клондайка из циклов ""Смок Беллью"" и ""Смок и Малыш"" аляскинских старателей ждут самые разнообразные приключения, иногда забавные, иногда опасные и трагические. Но в любых обстоятельствах, от гонок на собачьих упряжках до плена у индейцев, герои не теряют мужества и присутствия духа.",3 400 тг,5,Эксмо,2016 г.,9785699884919,640,Твердый,210 мм x 130 мм,25 мм,555 г.,http://www.bookcity.kz/content/images/thumbs/5087796_1426345.jpeg
Морской волк,Лондон Д. ,"Морской волк 001.051. Азбука-Классика (мягк/обл.) Продолжаются приключения и на суше: влюбленных героев ждет робинзонада на уединенном острове, где они будут почти счастливы.  Приключенческая романтика в ""Морском волке"" соседствует с ницшеанской этикой (и попытками ее развенчать). Сверхчеловек Дж. Лондона - Волк Ларсен, циничный красавец-капитан промысловой шхуны, признающий только силу и не знающий жалости полуживотное, грубый моряк, которому ничего не стоит убить человека, - и в то же время одинокая душа, читатель Шекспира и Теннисона.",1 200 тг,5,Азбука-Аттикус,2018 г.,978538902028302,352,Мягкий,15 мм,174 г.,Неизвестно,http://www.bookcity.kz/content/images/thumbs/5060099_1400791.jpeg
Морфий,Булгаков М.А.,"С рассказов, вышедших под общим названием ""Записки юного врача"", началась яркая писательская биография М.А.Булгакова, будущего автора знаменитого романа ""Мастер и Маргарита"". В настоящий сборник включена также во многом автобиографичная повесть ""Морфий"" и не потерявший своей актуальности и в наше время рассказ о событиях на Северном Кавказе в 1918-1920 годах.",1 000 тг,3,Азбука-Аттикус,2012 г.,978538904755602,192,Мягкий,190 мм x 105 мм,13 мм,101 г.,http://www.bookcity.kz/content/images/thumbs/5049339_1392973.jpeg
Морфий. Записки юного врача,Булгаков М.А.,"""Морфий. Записки юного врача"" - уникальный сборник рассказов Михаила Булгакова, который раскрывает важную, но не всем известную сторону жизни автора - молодого врача, и, одновременно, пациента, пристрастившегося к дозам морфина и пытающегося вырваться из наркотического плена. Булгакову удалось пугающе подробно описать ощущения морфиниста, всю глубину отчаяния и бесконечную надежду на освобождение от разрушающей зависимости.  Рассказы во многом основаны на опыте работы Булгакова врачом в сельской больнице, где будущий писатель, проводя сложнейшие операции, пытался осмыслить свое жизненное предназначение.",1 200 тг,5,Эксмо,2015 г.,9785699420599,192,Мягкий,115 мм x 180 мм,16 мм,170 г.,http://www.bookcity.kz/content/images/thumbs/5006796_1325529.jpeg
"Моряк, которого разлюбило море",Мисима Ю.,"Юкио Мисима - самый знаменитый и читаемый в мире японский писатель. Прославился он в равной степени как своими произведениями во всех мыслимых жанрах (романы, пьесы, рассказы, эссе), так и экстравагантным стилем жизни и смерти (харакири после неудачной попытки монархического переворота). «Моряк, которого разлюбило море», возможно, самый страстный роман Мисимы. В центре сюжета судьбы трех людей: мужчины, женщины, подростка. Их чувства, сплетенные в единый клубок, который невозможно распутать, стремительные события и внезапный, невообразимый финал… Роман безусловно придется по душе всем поклонникам великого японского мастера.",1 200 тг,5,Азбука-Аттикус,2017 г.,978538911945101,160,Мягкий,13 мм,85 г.,Неизвестно,http://www.bookcity.kz/content/images/thumbs/5110871_1440262.jpeg
